key	quote_person_onscreen	quote_person_key	unknown
236	If ever there was a holy war, it was that which saved our liberties and gave us independence.	thomas_jefferson_1	
237	We prefer war in all cases to tribute under any form and to any people whatever.	thomas_jefferson_1	
238	I have seen enough of one war never to wish to see another.	thomas_jefferson_1	
239	The greatest [calamity] which could befall [us would be] submission to a government of unlimited powers.	thomas_jefferson_1	
241	This is the fourth?	thomas_jefferson_2	
242	The harder the conflict, the more glorious the triumph.	thomas_paine	
243	Government, even in its best state, is but a necessary evil; in its worst state, an intolerable one.	thomas_paine	
244	Character is much easier kept than recovered.	thomas_paine	
245	Those who expect to reap the blessings of freedom must, like men, undergo the fatigue of supporting it.	thomas_paine	
246	Lead, follow, or get out of the way.	thomas_paine	
247	From such beginnings of governments, what could be expected, but a continual system of war and extortion?	thomas_paine	
248	The cunning of the fox is as murderous as the violence of the wolf.	thomas_paine	
249	The history of the present King of Great Britain is a history of repeated injuries and usurpations, all having in\n\ndirect object the establishment of an absolute Tyranny over these States.	declaration_of_independence	
250	Qui desiderat pacem, praeparet bellum. (Let him who desires peace, prepare for war.)	vegetius	
251	No problem can stand the assault of sustained thinking.	voltaire_1	
252	Those who can make you believe absurdities can make you commit atrocities.	voltaire_1	
253	God is not on the side of the big battalions, but on the side of those who shoot best.	voltaire_1	
254	Where some states possess an army, the Prussian Army possesses a state.	voltaire_1	
255	In this country we find it pays to shoot an admiral from time to time to encourage the others.	voltaire_1	
256	I disapprove of what you say, but I will defend to the death your right to say it.	voltaire_1	
258	Fear comes from uncertainty. When we are absolutely certain, whether of our worth or worthlessness, we are almost impervious to fear.	william_congreve	
259	Admirals extolled for standing still, or doing nothing with a deal of skill.	william_cowper_1	
260	War's a game, which, were their subjects wise, Kings would not play at.	william_cowper_2	
261	A noisy man is always in the right.	william_cowper_2	
262	There is one certain means by which I can be sure never to see my country's ruin: I will die in the last ditch.	william_III	
263	The air of England is too pure for a slave to breathe, and so everyone who breathes it becomes free.\n\nEveryone who comes to this island is entitled to the protection of English law,\n\nwhatever oppression he may have suffered and whatever may be the colour of his skin.	lord_mansfield	
264	Where a goat can go, a man can go, where a man can go, he can drag a gun.	william_phillips	
265	If I were an American, as I am an Englishman, while a foreign troop was landed in my country, I would never lay down my arms - never - never - never!	pitt_the_elder	
266	Where laws end, tyranny begins.	pitt_the_elder	
267	Oh, my country! How I leave my country!	pitt_the_younger	
268	Never do today what you can put off 'til tomorrow.	william_pulteney	
269	Let me have war, say I; it exceeds peace as far as day does night; it’s spritely, waking, audible, and full of vent.	william_shakespeare	
270	Cry 'Havoc!', and let slip the dogs of war!	william_shakespeare	
271	Those entrusted with arms should be persons of some substance and stake in the country.	william_windham	
272	Not without hope we suffer and we mourn.	william_wordsworth	
273	Strongest minds are often those whom the noisy world hears least.	william_wordsworth	
274	The good die first, and they whose hearts are dry as summer burn to the socket.	william_wordsworth	
275	Like an army defeated the snow hath retreated.	william_wordsworth	
276	Louis XVI of France: "Is it a revolt?" A Duke of France: "No, Sir, it's a revolution."	louis_XVI_2	
277	There are so few who can grow old with a good grace.	richard_steele	
278	No one can guarantee success in war, but only deserve it.	winston_churchill	
279	When the white man discovered this country Indians were running it. No taxes no debt, women did all the work.\n\nWhite man thought he could improve on a system like this?	old_cherokee_saying	tribal_playable
280	Grown men can learn from very little children, for the hearts of the little children are pure.\n\nTherefore, the Great Spirit may show to them many things which older people miss.	black_elk	tribal_playable
281	A very great vision is needed and the man who has it must follow it as the eagle seeks the deepest blue of the sky.	crazy_horse	tribal_playable
282	I am tired of fighting...from where the sun now stands, I will fight no more.	chief_joseph	tribal_playable
283	The Great Spirit Chief who rules above all will smile upon this land…and this time the Indian race is waiting and praying.	chief_joseph	tribal_playable
284	Treat the earth well. It was not given to you by your parents, it was loaned to you by your children.	native_proverb	tribal_playable
285	All things share the same breath - the beast, the tree, the man, the air shares its spirit with all the life it supports.	chief_seattle	tribal_playable
286	When a white army battles Indians and wins, it is called a great victory, but if they lose it is called a massacre.	chiksika_shawnee	tribal_playable
287	We are now about to take our leave and kind farewell to our native land, the country the Great Spirit gave our Fathers, we are on the eve of leaving that country that gave us birth,\n\nit is with sorrow we are forced by the white man to quit the scenes of our childhood...we bid farewell to it and all we hold dear.	charles_hicks	tribal_playable
288	One does not sell the land people walk on.	crazy_horse	tribal_playable
289	What is life? It is the flash of a firefly in the night. It is the breath of a buffalo in the wintertime.\n\nIt is the little shadow which runs across the grass and loses itself in the sunset.	crowfoot	tribal_playable
290	I have seen that in any great undertaking it is not enough for a man to depend simply upon himself.	lone_man	tribal_playable
291	How smooth must be the language of the whites,\n\nwhen they can make right look like wrong, and wrong like right.	black_hawk	tribal_playable
292	We know our lands have now become more valuable. The white people think we do not know their value;\n\nbut we know that the land is everlasting, and the few goods we receive for it are soon worn out and gone.	canassatego	tribal_playable
293	When it comes time to die, be not like those whose hearts are filled with the fear of death,\n\nso when their time comes they weep and pray for a little more time to live their lives\n\nover again in a different way. Sing your death song, and die like a hero going home.	chief_aupumut	tribal_playable
294	When the Earth is sick, the animals will begin to disappear. When that happens, the Warriors of the Rainbow will come to save them.	chief_seattle	tribal_playable
295	I am a red man. If the Great Spirit had desired me to be a white man he would have made me so in the first place.	sitting_bull	tribal_playable
296	There is no death. Only a change of worlds.	native_proverb	tribal_playable
297	At some time there shall come among you a stranger, speaking a language you do not understand.\n\nHe will try to buy the land from you, but do not sell it; keep it for an inheritance to your children.	aseenewub	tribal_playable
298	It's our stuff. We made it and we know best how to use it and care for it. And now we're going to get it back.	john_pretty	tribal_playable
299	Where today are the Pequot? Where are the Narragansett, the Mohican, the Pokanoket, and many other once powerful tribes of our people? They have vanished before the avarice and the oppression of the White Man, as snow before a summer sun.	chief_tecumseh_shawnee	tribal_playable
300	The ground on which we stand is sacred ground. It is the blood of our ancestors.	chief_plenty_coups	tribal_playable
301	I will follow the white man's trail. I will make him my friend, but I will not bend my back to his burdens. I will be cunning as a coyote.\n\nI will ask him to help me understand his ways, then I will prepare the way for my children, and their children.\n\nThe Great Spirit has shown me - a day will come when they will outrun the white man in his own shoes.	many_horses	tribal_playable
302	Will we let ourselves be destroyed in our turn without a struggle, give up our homes, our country bequeathed to us by the Great Spirit,\n\nthe graves of our dead and everything that is dear and sacred to us? I know you will cry with me, 'Never! Never!'	chief_tecumseh_shawnee	tribal_playable
303	It is better to have less thunder in the mouth and more lightning in the hand.	apache_proverb	tribal_playable
304	Those that lie down with dogs, get up with fleas.	blackfoot_proverb	tribal_playable
305	Those who have one foot in the canoe and one foot in the boat are going to fall into the river.	tuscarora_proverb	tribal_playable
306	Force, no matter how concealed, begets resistance.	lakota_proverb	tribal_playable
307	You can't wake a person who is pretending to be asleep.	navajo_proverb	tribal_playable
308	He who would do great things should not attempt them all alone.	seneca_proverb	tribal_playable
309	A brave man dies but once, a coward many times.	unknown_tribe	tribal_playable
310	Seek wisdom, not knowledge. Knowledge is of the past, Wisdom is of the future.	lumbee_proverb	tribal_playable
311	White men have too many chiefs.	nex_perce_saying	tribal_playable
313	What treaty have the Sioux made with the white man that we have broken? Not one.\n\nWhat treaty have the white man ever made with us that they have kept? Not one.	sitting_bull	tribal_playable
